invoice_type_id,display_name,description,agent_context,enabled
VIAJES,"A.VII Viajes, estancias y dietas","Travel expenses: flights, hotels, accommodation and daily per diems","Facturas de gastos de viaje. Documentos típicos: billetes de avión/tren, facturas de hotel, recibos de taxi/transporte, justificantes de dietas. Buscar: importe total, fecha, nombre del viajero, destino, motivo del viaje. Las dietas deben indicar número de días y tarifa diaria. A menudo hay múltiples páginas con gastos desglosados. Palabras clave positivas: Boarding Pass, Hotel Receipt, Passenger, viajero, destino, dieta, per diem. No clasificar como VIAJES si el paquete trata principalmente de compra de bienes, solicitud de compra, procurement, bid summary, supplier quotation, payment voucher, wheat flour, equipment, materials or consumables; esos casos pertenecen normalmente a EQUIPOS o CONSUMIBLES.",true
PERS_LOCAL,"A.V.2 Personal Local","Local staff payroll: salaries and employment costs for locally-contracted staff","Nóminas y costes laborales de personal contratado localmente. Documentos: nómina mensual, recibo de salario, TC2/RNT de Seguridad Social. Extraer: nombre del trabajador, período (mes/año), salario bruto, retención IRPF, cuota SS empleado, cuota SS empresa, salario neto. Buscar cabeceras: Nómina, Salario, Haberes, Deducciones, Seguridad Social, IRPF.",true
PERS_SEDE,"A.V.3 Personal En sede","Headquarters staff costs: salaries and employment costs for HQ-based staff","Costes de personal en sede central. Estructura similar a personal local pero bajo normativa del país sede. Puede incluir porcentaje de dedicación al proyecto. Extraer los mismos campos que nómina local. Prestar atención a: porcentaje de imputación, período de dedicación, coste total vs coste imputado al proyecto.",true
EQUIPOS,"A.III Equipos y materiales","Equipment and materials: durable goods purchases requiring asset registration","Facturas de compra de equipos y materiales duraderos. Documentos: factura de proveedor, albarán, orden de compra, purchase request, procurement bid summary, supplier quotation, cheque/payment voucher. Extraer: proveedor, número de factura, fecha, descripción detallada del equipo/material, cantidad, precio unitario, base imponible, IVA, total. Los equipos de alto valor pueden requerir número de serie para el registro de activos. Buscar: Factura, NIF proveedor, modelo, referencia, purchase order, quotation, bid summary, payment voucher.",true
CONSUMIBLES,"A.III.2 Consumibles","Consumable supplies: office materials and non-durable goods","Facturas de material fungible y consumibles: papelería, material de oficina, fungible informático, material sanitario, alimentos o suministros no duraderos. Estructura más sencilla que equipos — sin necesidad de registro de activos. Extraer: proveedor, fecha, descripción de artículos, base imponible, IVA, total. Pueden ser tickets, facturas simplificadas, purchase requests, supplier quotations, bid summaries or payment vouchers. Ejemplos típicos: wheat flour, office supplies, hygiene materials, medical consumables.",true
